<?xml version="1.0" encoding="utf-8"?>
 <Lista xmlns:xsi="http://www.w3.org/2001/XMLSchema-instance" 
xsi:noNamespaceSchemaLocation="curso.xsd">
	<Curso>
		<Titulo>Lenguaje de Marcas</Titulo>
		<nocturno>false</nocturno>
		<Horas>200</Horas>
		<fechaComienzo>2017-03-17</fechaComienzo>
	</Curso>
	<Curso>
		<Titulo>BBDD</Titulo>
		<nocturno>true</nocturno>
		<Horas>210</Horas>
		<fechaComienzo>2017-03-20</fechaComienzo>
	</Curso>
 </Lista>

